{
  "id": "salt-core-v1",
  "revision": "draft-2",
  "status": "draft",
  "description": "Example suite. Its cases are smoke fixtures that prove the harness plumbing; they are not a Salt benchmark. A Salt maintainer must approve criteria and references against the pinned package version before any live score is interpreted.",
  "salt": {
    "packages": {
      "@salt-ds/core": "1.71.x"
    },
    "docs_revision": "public saltdesignsystem.com pages reviewed 2026-09-23; not a release-pinned snapshot"
  },
  "canary": "SALT-EVAL-CANARY-5e6ad241-eb42-4dcf-a9e0-636a11e71ecd",
  "judge_thresholds": {
    "max_false_accept_rate": 0.0,
    "max_false_reject_rate": 0.0,
    "max_review_rate": 0.2
  }
}
